{
  "agentName": "researcher",
  "description": "Research the requested topic",
  "parentGraphNamespace": [
    "tools:parent"
  ],
  "parentToolCallId": "tf:tool:W1sidG9vbHM6cGFyZW50Il0sImNhbGwtdGFzayJd",
  "requestRunId": "run-known",
  "schema": "tinkerfin.subagent-provenance",
  "subagentInvocationId": "subagent-f40ee085-115c-51b6-b683-45659b5b3639"
}
